station_id,name,source,provider,QAPP,state,latitude,longitude
tiburon-water-tibc1,* CeNCOOS in situ water monitoring data at Romberg Tiburon Center Pier,Romberg Tiburon Center SFSU/CeNCOOS,CeNCOOS,,California,37.8915,-122.4467
edu_ucsc_scwharf1,* CeNCOOS in situ Water monitoring data at the Santa Cruz municipal wharf,"University of California, Santa Cruz",CeNCOOS,,California,36.9603,-122.0203
edu_humboldt_tdp,"* CeNCOOS in situ water monitoring data at Trinidad Head, California",Humboldt State University/CeNCOOS,CeNCOOS,,California,41.055,-124.147
carquinez,* CeNCOOS in situ water quality monitoring at Carquinez at the California Maritime campus.,San Francisco State University and The California Maritime Academy,CeNCOOS,,California,38.0657,-122.2302
edu_humboldt_humboldt,* CeNCOOS in situ water quality monitoring at Humboldt Bay Pier.,Humboldt State University,CeNCOOS,,California,40.7775,-124.1965
edu_calpoly_marine_morro,* CeNCOOS in situ water quality monitoring at Morro bay.,"California Polytechnic State Univeristy, San Luis Obispo",CeNCOOS,,California,35.3708,-120.8589
wiyot_tribe_indianisland,* CeNCOOS in situ water quality monitoring at Tuluwat (Indian Island).,Humboldt State University,CeNCOOS,,California,40.815,-124.1575
mlml_mlml_sea,* CeNCOOS in situ water quality monitoring using the seawater input for Moss Landing Marine Laboratory.,Moss Landing Marine Laboratory,CeNCOOS,,California,36.8025,-121.7915
hog-island-hatchery,Hog Island Oyster,"University of California Davis, Bodega Marine Laboratory",CeNCOOS,,California,38.162,-122.8939
humboldt-bay-burkeolator,Humboldt Bay Burke-O-Lator,Central & Northern California Ocean Observing System (CeNCOOS),CeNCOOS,,California,40.794,-124.193
monterey-bay-aquarium-seawate,Monterey Bay Aquarium Seawater Intake,Monterey Bay Aquarium,CeNCOOS,,California,36.6186,-121.9015
morro-bay-bs1,Morro Bay - BS1,"California Polytechnic State University, Center for Coastal Marine Sciences",CeNCOOS,,California,35.3338,-120.8473
newport-pier-automated-shore-sta,Newport Pier Automated Shore Station,Southern California Coastal Ocean Observing System (SCCOOS),CeNCOOS,,California,33.6073,-117.9289
ooi-ce01issm-rid16-06-phsend000,Coastal Endurance: Oregon Inshore Surface Mooring: Near Surface Instrument Frame: Seawater pH,Ocean Observatories Initiative (OOI),OOI,,Oregon,44.6568,-124.0971
ooi-ce01issm-mfd35-06-phsend000,Coastal Endurance: Oregon Inshore Surface Mooring: Seafloor Multi-Function Node (MFN): Seawater pH,Ocean Observatories Initiative (OOI),OOI,,Oregon,44.6568,-124.0971
ooi-ce04osbp-lj01c-10-phsend107,Coastal Endurance: Oregon Offshore Cabled Benthic Experiment Package: Low-Power JBox (LJ01C): Seawater pH,Ocean Observatories Initiative (OOI),OOI,,Oregon,44.3695,-124.9537
ooi-ce04osps-pc01b-4b-phsena106,Coastal Endurance: Oregon Offshore Cabled Shallow Profiler Mooring: 200m Platform (PC01B): Seawater pH,Ocean Observatories Initiative (OOI),OOI,,Oregon,44.3742,-124.9565
ooi-ce04ossm-rid26-06-phsend000,Coastal Endurance: Oregon Offshore Surface Mooring: Near Surface Instrument Frame: Seawater pH,Ocean Observatories Initiative (OOI),OOI,,Oregon,44.3787,-124.9451
ooi-ce02shbp-lj01d-10-phsend103,Coastal Endurance: Oregon Shelf Cabled Benthic Experiment Package: Low-Power JBox (LJ01D): Seawater pH,Ocean Observatories Initiative (OOI),OOI,,Oregon,44.6371,-124.3059
ooi-ce02shsm-rid26-06-phsend000,Coastal Endurance: Oregon Shelf Surface Mooring: Near Surface Instrument Frame: Seawater pH,Ocean Observatories Initiative (OOI),OOI,,Oregon,44.6358,-124.3035
ooi-ce06issm-rid16-06-phsend000,Coastal Endurance: Washington Inshore Surface Mooring: Near Surface Instrument Frame: Seawater pH,Ocean Observatories Initiative (OOI),OOI,,Washington,47.1345,-124.2709
ooi-ce06issm-mfd35-06-phsend000,Coastal Endurance: Washington Inshore Surface Mooring: Seafloor Multi-Function Node (MFN): Seawater pH,Ocean Observatories Initiative (OOI),OOI,,Washington,47.1345,-124.2709
ooi-ce09ossm-rid26-06-phsend000,Coastal Endurance: Washington Offshore Surface Mooring: Near Surface Instrument Frame: Seawater pH,Ocean Observatories Initiative (OOI),OOI,,Washington,46.8537,-124.9594
ooi-ce09ossm-mfd35-06-phsend000,Coastal Endurance: Washington Offshore Surface Mooring: Seafloor Multi-Function Node (MFN): Seawater pH,Ocean Observatories Initiative (OOI),OOI,,Washington,46.8537,-124.9594
ooi-ce07shsm-rid26-06-phsend000,Coastal Endurance: Washington Shelf Surface Mooring: Near Surface Instrument Frame: Seawater pH,Ocean Observatories Initiative (OOI),OOI,,Washington,46.9865,-124.5692
ooi-ce07shsm-mfd35-06-phsend000,Coastal Endurance: Washington Shelf Surface Mooring: Seafloor Multi-Function Node (MFN): Seawater pH,Ocean Observatories Initiative (OOI),OOI,,Washington,46.9865,-124.5692
ooi-rs03axps-pc03a-4b-phsena302,Regional Cabled Array: Axial Base Shallow Profiler Mooring: 200m Platform (PC03A): Seawater pH,Ocean Observatories Initiative (OOI),OOI,,,45.8305,-129.7533
ooi-rs01sbps-pc01a-4b-phsena102,Regional Cabled Array: Oregon Slope Base Shallow Profiler Mooring: 200m Platform (PC01A): Seawater pH,Ocean Observatories Initiative (OOI),OOI,,Oregon,44.529,-125.3897
APSH_Seward1,AOOS Burkolator at Alutiiq Pride Shellfish Hatchery,Alutiiq Pride Shellfish,IPACOA,,Alaska,60.0992,-149.4428
OCAL_Ketchikan1,AOOS Burkolator at OceansAlaska Ketchikan Shellfish Hatchery,OceansAlaska,IPACOA,,Alaska,55.315,-131.5954
APL_Chaba,Ćháʔba· UW/NANOOS Moored Buoy near La Push,APL-UW,IPACOA,,Washington,47.9627,-124.958
HIOC_Hogisland1,CeNCOOS Burkolator at Hog Island Oyster Farm,Hog Island Oysters,IPACOA,,California,38.162,-122.8939
FBO_Fannybay1,"Fanny Bay Oysters, Baynes Sound",FannyBayOysters,IPACOA,,British Columbia,49.4716,-124.7927
HAKAI_KCBuoy,"Seaology CO2 Buoy in Kwakshua Channel, BC",Hakai Institute,IPACOA,,British Columbia,51.6501,-127.9664
HAKAI_Quadra1,Quadra Island Field Station at Hyacinthe Bay,Hakai Institute,IPACOA,,British Columbia,50.116,-125.222
OSU_NOAA_OI,NCDC Optimum Interpolation SST,NOAA-NCDC,IPACOA,,"Washington, Oregon, California, British Columbia",46.1,-129.5
NDBC_46041,NDBC 46041 - Cape Elizabeth - 45NM NW of Aberdeen,NDBC,IPACOA,,Washington,47.353,-124.731
NERRS_elkapwq,"Azevedo Pond (elkapwq), Elkhorn Slough Reserve",NERRS,IPACOA,,California,36.8457,-121.7538
NERRS_elksmwq,"South Marsh (elksmwq), Elkhorn Slough Reserve",NERRS,IPACOA,,California,36.8179,-121.7394
NERRS_elkvmwq,"Vierra Mouth (elkvmwq), Elkhorn Slough Reserve",NERRS,IPACOA,,California,36.8111,-121.7792
NERRS_job09wq,"Station 9 (job09wq), Jobos Bay Reserve",NERRS,IPACOA,,Puerto Rico,17.9437,-66.2385
NERRS_job20wq,"Station 20 (job20wq), Jobos Bay Reserve",NERRS,IPACOA,,Puerto Rico,17.9303,-66.2115
NERRS_kachdwq,"Homer Dolphin Deep (kachdwq), Kachemak Bay Reserve",NERRS,IPACOA,,Alaska,59.602,-151.4088
NERRS_kacsdwq,"Seldovia Deep (kacsdwq), Kachemak Bay Reserve",NERRS,IPACOA,,Alaska,59.441,-151.721
NERRS_pdbbpwq,"Ploeg Channel (pdbbpwq), Padilla Bay Reserve",NERRS,IPACOA,,Washington,48.5563,-122.5309
NERRS_pdbbywq,"Bayview Channel (pdbbywq), Padilla Bay Reserve",NERRS,IPACOA,,Washington,48.4961,-122.5021
NERRS_sfbccwq,"China Camp (sfbccwq), San Francisco Bay Reserve",NERRS,IPACOA,,California,38.0012,-122.4604
NERRS_sfbfmwq,"First Mallard (sfbfmwq), San Francisco Bay Reserve",NERRS,IPACOA,,California,38.1949,-122.0328
NERRS_sfbgcwq,"Gallinas Creek (sfbgcwq), San Francisco Bay Reserve",NERRS,IPACOA,,California,38.0159,-122.5085
NERRS_sfbsmwq,"Second Mallard (sfbsmwq), San Francisco Bay Reserve",NERRS,IPACOA,,California,38.1841,-122.0136
NERRS_soschwq,"Charleston Bridge (soschwq), South Slough Reserve",NERRS,IPACOA,,Oregon,43.3377,-124.3205
NERRS_sosvawq,"Valino Island (sosvawq), South Slough Reserve",NERRS,IPACOA,,Oregon,43.3172,-124.3216
NERRS_soswiwq,"Winchester Arm (soswiwq), South Slough Reserve",NERRS,IPACOA,,Oregon,43.2824,-124.3203
NERRS_tjroswq,"Oneonta Slough (tjroswq), Tijuana River Reserve",NERRS,IPACOA,,California,32.5683,-117.1313
ORCA_Dabobbay,Profiling Buoy at Dabob Bay - Hood Canal,ORCA-UW,IPACOA,,Washington,47.8034,-122.8029
ORCA_Twanoh,Profiling Buoy at Twanoh - Hood Canal,ORCA-UW,IPACOA,,Washington,47.375,-123.0083
OSU_CB06,"CB-06, 6NM W of Coos Bay",OSU,IPACOA,,Oregon,43.295,-124.5367
OSU_NH10,"NH-10 Buoy, Newport",OSU,IPACOA,,Oregon,44.645,-124.2985
PMELCO2_coastalla,Coastal Louisiana (LA) Buoy,PMEL-CO2,IPACOA,,Louisiana,28.9,-90.5
PMELCO2_alawai,Ala Wai HiOOS Mooring,PMEL-CO2,IPACOA,,Hawaii,21.28,-157.85
PMELCO2_cce1,California Current Ecosystem 1 Mooring,PMEL-CO2,IPACOA,,California,33.48,-122.53
PMELCO2_cce2,California Current Ecosystem 2 Mooring,PMEL-CO2,IPACOA,,California,34.324,-120.814
PMELCO2_crimp,Coral Reef Instrumented Monitoring Platform 2,PMEL-CO2,IPACOA,,Hawaii,21.46,-157.8
PMELCO2_firstlanding,CBIBS OA Buoy at First Landing,PMEL-CO2,IPACOA,,Maryland,37.0,-76.1
PMELCO2_gakoa,Gulf of Alaska OA Mooring,PMEL-CO2,IPACOA,,Alaska,59.85,-149.5
PMELCO2_kaneohe,Kaneohe Offshore HiOOS Observatory,PMEL-CO2,IPACOA,,Hawaii,21.48,-157.78
PMELCO2_kilonalu,Kilo Nalu Offshore HiOOS Observatory,PMEL-CO2,IPACOA,,Hawaii,21.29,-157.87
PMELCO2_kodiak,"Kodiak, Gulf of Alaska OA Mooring",PMEL-CO2,IPACOA,,Alaska,57.7,-152.31
PMELCO2_laparguera,La Parguera Coral Reef OA Mooring,PMEL-CO2,IPACOA,,Puerto Rico,17.95,-67.05
PMELCO2_m2,SE Bering Sea M2 OA Mooring,PMEL-CO2,IPACOA,,Alaska,56.51,-164.04
PMELCO2_nh,Gulf of Maine Mooring,PMEL-CO2,IPACOA,,New Hampshire,43.02,-70.54
PMELCO2_seak,"Port Conclusion, Gulf of Alaska OA Mooring",PMEL-CO2,IPACOA,,Alaska,56.0,-134.0
PMELCO2_whots,WHOI Hawaii Ocean Time-series Station Mooring,PMEL-CO2,IPACOA,,Hawaii,22.67,-157.98
PSI_Baycenter,"PCSGA - Bay Center Port mooring, Willapa Bay",PSI,IPACOA,,Washington,46.629,-123.9516
PCS_Penncove1,"Penn Cove Shellfish, Coupeville - Whidbey Island",PennCoveShellfish,IPACOA,,Washington,48.2191,-122.7048
CARLSBD_Aquafarm1,Agua Hedionda Lagoon - Carlsbad Aquafarm,Carlsbad Aquafarm,IPACOA,,California,33.1407,-117.3389
KC_SEAQYSI,Seattle Aquarium Mooring - Elliott Bay,King County,IPACOA,,Washington,47.608,-122.3438
STA_Sitka1,Sitka Tribe of Alaska Burke-o-Lator site - Sitka,STA,IPACOA,,Alaska,57.0526,-135.3456
TAF_Dabobbay,"PCSGA - Taylor Shellfish Hatchery intakes, Dabob Bay",TaylorShellfish,IPACOA,,Washington,47.8199,-122.8215
WCSH_Whiskey1,"PCSGA - Whiskey Creek Shellfish Hatchery, Netarts Bay",WhiskeyCrShelfish,IPACOA,,Oregon,45.4214,-123.9362
DOCKTON,Dockton Park,King County,King County,,Washington,47.37611,-122.45722
POINT_WILLIAMS,Point Williams,King County,King County,,Washington,47.53716,-122.40612
QUARTER_MASTER_YC,Quarter Master Yacht Club,King County,King County,,Washington,47.39394,-122.4635
SEATTLE_AQUARIUM,Seattle Aquarium Mooring - Elliott Bay,King County,King County,,Washington,47.60786,-122.3436
